{
  "format": "freedom.module/v1",
  "module_id": "github-social",
  "owner_role": "foundation",
  "owned_paths": [
    "apps/platform-api/src/routes/github-social.ts",
    "apps/portal-web/src/modules/GitHubAuthorFollow.tsx",
    "apps/portal-web/src/modules/GitHubCallback.tsx",
    "apps/portal-web/src/modules/github-social-client.ts",
    "modules/github-social/provider.ts",
    "modules/github-social/service.ts",
    "docs/development/github-social.md",
    "tests/e2e/github-social.spec.ts",
    "tests/runtime/github-social-routes.test.ts",
    "tests/runtime/github-social-store.test.ts",
    "tests/runtime/github-social.test.ts",
    "apps/portal-web/src/modules/GitHubSocial.tsx",
    "apps/portal-web/src/modules/SkillBookCover.tsx",
    "tests/runtime/skill-book-star-gate.test.ts",
    "modules/github-social/**",
    "apps/portal-web/src/modules/GitHubSocial.css",
    "apps/portal-web/src/skill-social.tsx"
  ],
  "public_exports": [],
  "dependencies": [
    "command-core",
    "community",
    "development",
    "shared",
    "platform-admin-portal"
  ],
  "contract_families": [],
  "client_profiles": [
    "member"
  ],
  "instructions": [
    "AGENTS.md",
    "docs/development/github-social.md",
    "docs/platform-plan/execution/unified-foundation/02-principal-command.md"
  ],
  "invariants": [
    "current-authority-before-replay",
    "no-secrets-in-artifacts"
  ],
  "tests": [
    "runtime.full"
  ],
  "surfaces": [
    {
      "surface_id": "member.github-social",
      "kind": "http",
      "entry": "apps/platform-api/src/routes/github-social.ts",
      "operations": [
        "member.github-follow.read",
        "member.github-follow.set"
      ],
      "auth_profile": "member-session"
    }
  ]
}
