{
  "client_profiles": [],
  "contract_families": [],
  "dependencies": [
    "assets",
    "command-core",
    "execution-runs",
    "local-demo-data",
    "public-guide-assets",
    "platform-admin-portal"
  ],
  "format": "freedom.module/v1",
  "instructions": [
    "AGENTS.md",
    "CONTRIBUTING.md",
    "docs/development/e2e-harness.md",
    "governance/README.md"
  ],
  "invariants": [
    "browser-server-local-only",
    "fixture-flags-never-combined",
    "github-fetch-stubbed-when-flagged",
    "isolated-fp-e2e-schema",
    "link-preview-fetch-is-local",
    "port-from-freedom-e2e-port",
    "single-playwright-worker"
  ],
  "module_id": "e2e-harness",
  "owned_paths": [
    "docs/development/e2e-harness.md",
    "playwright.config.ts",
    "scripts/e2e-server.ts",
    "scripts/run-e2e.mjs",
    "scripts/run-e2e.test.mjs",
    "tests/e2e/fixtures.ts",
    "tests/e2e/navigation.ts",
    "tests/e2e/quick-join.ts",
    "tests/e2e/guild-member-tiers.spec.ts",
    "scripts/ci/pinned-playwright.config.mjs",
    "scripts/ci/run-pinned-e2e.mjs",
    "tests/e2e/sharing-authoring-fixture.ts",
    "scripts/verify-cloud-candidate-members.ts",
    "scripts/verify-cloud-candidate-supplier.ts",
    "scripts/verify-cloud-candidate-lib.ts",
    "scripts/verify-cloud-candidate.ts",
    "scripts/verify-cloud-candidate.md",
    "tests/e2e/cloud-candidate-acceptance.spec.ts",
    "tests/e2e/cloud-candidate-supplier.spec.ts",
    "tests/e2e/member-feature-fixture.ts",
    "tests/e2e/event-banner.spec.ts",
    "packages/testing/github-collaboration.ts",
    "scripts/ci/pinned-guild-preview.config.mjs",
    "packages/testing/e2e-admin.ts",
    "packages/testing/e2e-auth-isolation.ts",
    "packages/testing/e2e-origin.ts",
    "tests/e2e/route-performance.ts",
    "tests/runtime/route-performance.test.ts"
  ],
  "owner_role": "foundation",
  "public_exports": [
    "tests/e2e/fixtures.ts",
    "tests/e2e/navigation.ts",
    "tests/e2e/quick-join.ts",
    "tests/e2e/route-performance.ts"
  ],
  "surfaces": [],
  "tests": [
    "e2e.harness",
    "runtime.full"
  ]
}
