{
  "client_profiles": [
    "member"
  ],
  "contract_families": [
    "preview"
  ],
  "dependencies": [],
  "format": "freedom.module/v1",
  "instructions": [
    "governance/README.md",
    "packages/contribution-tools/behavior-supervisor.md",
    "docs/platform-plan/execution/unified-foundation/01-contracts-and-governance.md"
  ],
  "invariants": [
    "current-authority-before-replay",
    "no-secrets-in-artifacts"
  ],
  "module_id": "governance",
  "owned_paths": [
    "governance/**",
    "packages/contribution-tools/**",
    "tests/runtime/fixed-behavior-harness.test.ts",
    "tests/integration/behavior-supervisor.test.ts",
    "scripts/freedom.mjs",
    "scripts/repository-bootstrap/**",
    "scripts/export-contract-bundle.mjs",
    "scripts/update-inventory.py",
    "docs/platform-plan/verification/**",
    "docs/platform-plan/execution/unified-foundation/**",
    ".github/workflows/verify.yml",
    ".github/workflows/blacksmith-onboarding.yml",
    ".github/CODEOWNERS",
    ".circleci/**",
    ".gitignore",
    "LICENSE",
    "package.json",
    "package-lock.json",
    "contracts/README.md",
    "scripts/runtime-full.mjs",
    "scripts/runtime-aggregate.mjs",
    "tests/contribution-tools/runtime-sharding.integration.test.mjs",
    ".github/workflows/trusted-consumer-libraries.yml",
    ".github/workflows/trusted-consumer-runtime.yml",
    "tests/integration/agent-kit-device-runtime.test.mjs",
    "tests/integration/native-consumer-runtime.test.ts",
    "tests/integration/consumer-supported-transition.test.mjs",
    "deploy/cloudflare/test/preflight.test.mjs",
    "deploy/cloudflare/preflight.mjs",
    "deploy/cloudflare/test/release-compatibility-adversarial.test.mjs",
    "deploy/cloudflare/environments.json",
    "deploy/cloudflare/lib/release-compatibility.mjs",
    "deploy/cloudflare/release-compatibility.md",
    "deploy/cloudflare/test/migration-plan.test.mjs",
    "deploy/cloudflare/test/release-compatibility.test.mjs",
    "deploy/cloudflare/test/release-agent-connections.test.mjs",
    "deploy/cloudflare/test/release-bootstrap-session.test.mjs",
    "deploy/cloudflare/test/release-bootstrap-status.test.mjs",
    "deploy/cloudflare/test/release-credential-broker.test.mjs",
    "deploy/cloudflare/test/release-credential-ingest.test.mjs",
    "deploy/cloudflare/test/release-device-authorization.test.mjs",
    "deploy/cloudflare/test/release-execution-run.test.mjs",
    "deploy/cloudflare/test/release-member-device-management.test.mjs",
    "deploy/cloudflare/test/release-member-model-settings.test.mjs",
    "deploy/cloudflare/test/release-member-prerequisites.test.mjs",
    "deploy/cloudflare/test/release-model-result.test.mjs",
    "deploy/cloudflare/test/release-model-step.test.mjs",
    "deploy/cloudflare/test/release-runtime-enrollment.test.mjs",
    "scripts/ci/select-affected-jobs.mjs",
    "scripts/ci/affected-jobs.md",
    "scripts/ci/derive-runtime-weights.mjs",
    "scripts/reconcile-issue-closures.mjs",
    ".github/workflows/reconcile-issue-closures.yml",
    "scripts/ci/select-affected-jobs.test.mjs",
    "scripts/ci/guild-presentation-profile.test.mjs",
    "scripts/ci/run-guild-runtime.mjs",
    "scripts/ci/verify-source-boundaries.py",
    "scripts/ci/test_source_boundaries.py",
    "scripts/ci/release-inventory.md",
    "freedom.project.yaml",
    "docs/platform-plan/contracts/project-manifest.schema.json",
    "docs/platform-plan/contracts/project-manifest.example.yaml",
    "docs/platform-plan/contracts/tests/test_client_credential_manifest.py",
    "docs/platform-plan/contracts/tests/test_project_manifest_custody.py"
  ],
  "owner_role": "foundation",
  "public_exports": [
    "packages/contribution-tools/contracts.mjs",
    "packages/contribution-tools/context.mjs"
  ],
  "surfaces": [
    {
      "surface_id": "development.freedom",
      "kind": "cli",
      "entry": "scripts/freedom.mjs",
      "operations": [
        "development.prepare",
        "development.context",
        "development.verify"
      ],
      "auth_profile": "local-checkout"
    },
    {
      "surface_id": "verification.runtime-full",
      "kind": "cli",
      "entry": "scripts/runtime-full.mjs",
      "operations": [
        "verification.runtime-full"
      ],
      "auth_profile": "local-test-only"
    },
    {
      "surface_id": "verification.consumer-source",
      "kind": "cli",
      "entry": "packages/contribution-tools/github-consumer-host.mjs",
      "operations": [
        "verification.consumer-source"
      ],
      "auth_profile": "fixed-github-host"
    },
    {
      "surface_id": "verification.consumer-runtime",
      "kind": "cli",
      "entry": "packages/contribution-tools/github-consumer-runtime-host.mjs",
      "operations": [
        "verification.consumer-runtime"
      ],
      "auth_profile": "fixed-github-host"
    },
    {
      "surface_id": "verification.agent-kit-device-driver",
      "kind": "cli",
      "entry": "packages/contribution-tools/agent-kit-device-target.mjs",
      "operations": [
        "verification.agent-kit-device-driver"
      ],
      "auth_profile": "isolated-fixed-host-fixture"
    }
  ],
  "tests": [
    "governance.unit",
    "runtime.full"
  ]
}
