{
  "format": "freedom.module/v1",
  "module_id": "resource-scopes",
  "owner_role": "foundation",
  "owned_paths": [
    "packages/resource-scopes/**",
    "contracts/common/**",
    "scripts/build-common-contracts.ts",
    "migrations/076_principal_resource_scopes.sql",
    "tests/runtime/resource-scopes.test.ts",
    "migrations/118_shop_service_identity.sql",
    "tests/runtime/shop-service-identity.test.ts",
    "tests/runtime/shop-service-grammar.test.ts",
    "migrations/125_tenant_row_security.sql"
  ],
  "public_exports": [
    "packages/resource-scopes/index.ts",
    "contracts/common/v1/identity.ts",
    "packages/resource-scopes/shop-service.ts",
    "packages/resource-scopes/tenant-transaction.ts"
  ],
  "dependencies": [
    "command-core"
  ],
  "contract_families": [
    "common"
  ],
  "client_profiles": [
    "member",
    "shop-api"
  ],
  "instructions": [
    "packages/resource-scopes/README.md",
    "docs/platform-plan/execution/unified-foundation/02-principal-command.md"
  ],
  "invariants": [
    "current-authority-before-replay",
    "scope-is-not-domain-authority",
    "legacy-member-receipt-compatibility",
    "service-is-not-owner-person",
    "purpose-and-environment-bound-key"
  ],
  "tests": [
    "runtime.resource-scopes",
    "runtime.full"
  ],
  "surfaces": []
}
