{
  "format": "freedom.module/v1",
  "module_id": "hosted-distribution",
  "owner_role": "foundation",
  "owned_paths": [
    "migrations/173_supply_structured_terms.sql",
    "tests/runtime/hosted-supply-structured-terms.test.ts",
    "modules/agent-commerce/hosted/distribution.ts",
    "modules/agent-commerce/hosted/distribution.md",
    "apps/platform-api/src/routes/hosted-distribution.ts",
    "apps/portal-web/src/modules/HostedDistribution.tsx",
    "contracts/guild-launchpad/v1/hosted-distribution.ts",
    "contracts/guild-launchpad/v1/hosted-distribution.schema.json",
    "migrations/144_hosted_distribution_offers.sql",
    "tests/runtime/hosted-distribution.test.ts",
    "tests/e2e/hosted-distribution.spec.ts",
    "contracts/guild-launchpad/v1/hosted-shared-order.ts",
    "migrations/161_hosted_shared_reservations.sql",
    "tests/runtime/hosted-shared-orders.test.ts",
    "contracts/guild-launchpad/v1/hosted-shared-order.schema.json",
    "apps/portal-web/src/modules/HostedSupplierOrders.tsx",
    "apps/portal-web/src/modules/HostedReservationSetting.tsx",
    "tests/e2e/hosted-shared-orders.spec.ts",
    "modules/agent-commerce/hosted/shared-authority.ts",
    "modules/agent-commerce/hosted/shared-orders.ts",
    "modules/agent-commerce/hosted/shared-quotes.ts",
    "modules/agent-commerce/hosted/supplier-orders.ts",
    "modules/agent-commerce/hosted/shared-order-contract.md",
    "contracts/guild-launchpad/v1/hosted-supply-catalog.ts",
    "contracts/guild-launchpad/v1/hosted-supply-catalog.schema.json",
    "apps/portal-web/src/modules/HostedSupplyCatalog.tsx",
    "tests/runtime/hosted-supply-catalog.test.ts",
    "tests/e2e/hosted-supply-catalog.spec.ts",
    "migrations/164_hosted_supply_catalogs.sql",
    "modules/agent-commerce/hosted/supply-availability.ts",
    "apps/portal-web/src/modules/HostedSupplyOffer.tsx",
    "modules/agent-commerce/hosted-ui/SupplyOfferPresentation.tsx",
    "modules/agent-commerce/hosted-ui/SupplyOfferText.ts",
    "modules/agent-commerce/hosted-ui/SupplyOffer.css",
    "modules/agent-commerce/hosted-ui/reseller-arrangement.ts",
    "tests/runtime/hosted-supply-offer-page.test.ts",
    "tests/e2e/hosted-supply-offer.spec.ts"
  ],
  "public_exports": [],
  "dependencies": [
    "agent-commerce",
    "commerce-fulfilment"
  ],
  "contract_families": [
    "common"
  ],
  "client_profiles": [
    "member"
  ],
  "instructions": [
    "modules/agent-commerce/README.md",
    "packages/resource-scopes/README.md",
    "docs/platform-plan/execution/unified-foundation/02-principal-command.md",
    "modules/agent-commerce/hosted/supply-terms.md",
    "modules/agent-commerce/hosted/shared-order-contract.md"
  ],
  "invariants": [
    "current-authority-before-replay",
    "service-is-not-owner-person",
    "purpose-and-environment-bound-key",
    "single-transaction-effects",
    "legacy-domain-replay-compatibility",
    "explicit-readonly-target"
  ],
  "tests": [
    "runtime.full"
  ],
  "surfaces": [
    {
      "surface_id": "commerce.hosted-distribution-api",
      "kind": "http",
      "entry": "apps/platform-api/src/routes/hosted-distribution.ts",
      "operations": [
        "store.supply-offer.list",
        "store.supply-offer.publish",
        "store.supply-offer.withdraw",
        "store.distribution.list",
        "store.distribution.propose",
        "store.distribution.decide",
        "store.distribution.withdraw",
        "store.supply-offer.read"
      ],
      "auth_profile": "member-session"
    },
    {
      "surface_id": "commerce.hosted-distribution-page",
      "kind": "page",
      "entry": "apps/portal-web/src/modules/HostedDistribution.tsx",
      "operations": [
        "store.supply-offer.list",
        "store.supply-offer.publish",
        "store.supply-offer.withdraw",
        "store.distribution.list",
        "store.distribution.propose",
        "store.distribution.decide",
        "store.distribution.withdraw"
      ],
      "auth_profile": "member-session"
    },
    {
      "surface_id": "commerce.hosted-order-supplier-page",
      "kind": "page",
      "entry": "apps/portal-web/src/modules/HostedSupplierOrders.tsx",
      "operations": [
        "storefront.supplier.orders.list",
        "storefront.supply-catalog.read"
      ],
      "auth_profile": "member-session"
    },
    {
      "surface_id": "commerce.hosted-supply-catalog-page",
      "kind": "page",
      "entry": "apps/portal-web/src/modules/HostedSupplyCatalog.tsx",
      "operations": [
        "storefront.supply-catalog.list",
        "storefront.supply-catalog.read",
        "storefront.supply-catalog.setup",
        "storefront.supply-product.list",
        "storefront.supply-product.create",
        "storefront.supply-product.update",
        "store.supply-terms.read",
        "store.supply-terms.update",
        "store.supply-offer.list",
        "store.supply-offer.publish",
        "store.supply-offer.withdraw",
        "store.distribution.list",
        "store.distribution.decide",
        "storefront.reservations.read",
        "storefront.reservations.configure",
        "storefront.supplier.orders.list"
      ],
      "auth_profile": "member-session"
    },
    {
      "surface_id": "commerce.hosted-supply-offer-page",
      "kind": "page",
      "entry": "apps/portal-web/src/modules/HostedSupplyOffer.tsx",
      "operations": [
        "store.supply-offer.read",
        "store.distribution.propose",
        "store.distribution.withdraw"
      ],
      "auth_profile": "member-session"
    }
  ]
}
