{
  "client_profiles": [
    "member"
  ],
  "contract_families": [
    "preview"
  ],
  "dependencies": [
    "assets",
    "command-core",
    "tenant-workspaces",
    "work"
  ],
  "format": "freedom.module/v1",
  "instructions": [
    "docs/platform-plan/execution/unified-foundation/00-baseline-and-decisions.md",
    "docs/platform-plan/execution/unified-foundation/02-principal-command.md",
    "docs/platform-plan/execution/unified-foundation/03-assets-private-work.md"
  ],
  "invariants": [
    "current-authority-before-replay",
    "no-secrets-in-artifacts"
  ],
  "module_id": "member-card",
  "owned_paths": [
    "modules/identity-membership/member-sharing.ts",
    "modules/identity-membership/social-links.ts",
    "modules/identity-membership/member-connections.ts",
    "tests/runtime/member-connections.test.ts",
    "tests/runtime/member-directory.test.ts",
    "docs/development/member-connections.md",
    "tests/runtime/social-links.test.ts",
    "tests/runtime/member-settings-session-clock.test.ts",
    "tests/runtime/friends-session-clock.test.ts",
    "tests/runtime/member-presence-session-clock.test.ts",
    "apps/portal-web/src/modules/MemberECard.tsx",
    "apps/portal-web/src/modules/MemberECard.css",
    "apps/portal-web/src/modules/Membership.tsx",
    "apps/portal-web/src/modules/PublicMemberPage.tsx",
    "apps/portal-web/src/modules/MemberCardShareActions.tsx",
    "tests/runtime/member-ecard.test.ts",
    "tests/e2e/member-ecard.spec.ts",
    "apps/portal-web/src/modules/MemberShare.tsx",
    "apps/portal-web/src/modules/MemberCardDownload.tsx",
    "apps/portal-web/src/modules/MemberCardQr.tsx",
    "apps/portal-web/src/modules/MemberEditorialCard.css",
    "migrations/112_member_card_editorial.sql",
    "tests/runtime/member-card-qr.test.ts",
    "tests/e2e/member-editorial-card.spec.ts",
    "apps/portal-web/public/licenses/member-card/**",
    "modules/identity-membership/blocks.ts",
    "apps/portal-web/src/modules/MemberBlocking.tsx",
    "tests/runtime/member-blocking.test.ts",
    "migrations/136_member_interaction_blocks.sql",
    "apps/platform-api/src/routes/members.ts",
    "apps/portal-web/src/modules/AccountSecurity.tsx",
    "apps/portal-web/src/modules/MemberDirectory.css",
    "modules/identity-membership/account-security.ts",
    "modules/identity-membership/password-recovery.ts",
    "tests/e2e/account-security.spec.ts",
    "tests/runtime/account-security.test.ts",
    "apps/portal-web/src/modules/AccountDeactivation.tsx",
    "apps/portal-web/src/modules/Onboarding.tsx",
    "apps/portal-web/src/modules/PreviewProfileMenu.tsx",
    "apps/portal-web/src/modules/WelcomePreview.tsx",
    "modules/identity-membership/deactivation.ts",
    "tests/e2e/account-deactivation.spec.ts",
    "tests/runtime/account-deactivation-ui.test.ts",
    "tests/runtime/account-deactivation.test.ts",
    "modules/identity-membership/email-change.ts",
    "apps/portal-web/src/modules/EmailChange.tsx",
    "migrations/156_login_email_change.sql",
    "tests/runtime/email-change.test.ts",
    "tests/runtime/portal-email-change.test.ts",
    "modules/identity-membership/email-verification.ts",
    "apps/portal-web/src/modules/EmailVerification.tsx",
    "migrations/157_email_verification.sql",
    "tests/runtime/email-verification.test.ts",
    "tests/runtime/portal-email-verification.test.ts",
    "tests/e2e/email-verification.spec.ts",
    "tests/e2e/email-change.spec.ts",
    "modules/identity-membership/totp.ts",
    "apps/portal-web/src/modules/TotpSettings.tsx",
    "apps/portal-web/src/modules/totp-setup.ts",
    "migrations/158_member_totp.sql",
    "tests/runtime/totp.test.ts",
    "tests/runtime/portal-totp.test.ts",
    "modules/identity-membership/service.ts",
    "tests/e2e/totp.spec.ts"
  ],
  "owner_role": "foundation",
  "public_exports": [
    "modules/identity-membership/member-sharing.ts",
    "modules/identity-membership/blocks.ts"
  ],
  "surfaces": [
    {
      "surface_id": "member.card.editor",
      "kind": "page",
      "entry": "apps/portal-web/src/modules/MemberECard.tsx",
      "operations": [
        "member.card.read",
        "member.card.update"
      ],
      "auth_profile": "member-session"
    },
    {
      "surface_id": "member.card.public",
      "kind": "page",
      "entry": "apps/portal-web/src/modules/PublicMemberPage.tsx",
      "operations": [
        "member.card.share.read"
      ],
      "auth_profile": "revocable-share"
    },
    {
      "surface_id": "member.blocking-controls",
      "kind": "page",
      "entry": "apps/portal-web/src/modules/MemberBlocking.tsx",
      "operations": [
        "member.block.list",
        "member.block.update"
      ],
      "auth_profile": "member-session"
    },
    {
      "surface_id": "member.account-security",
      "kind": "http",
      "entry": "apps/platform-api/src/routes/members.ts",
      "operations": [
        "member.password.change",
        "member.sessions.list",
        "member.sessions.revoke-others"
      ],
      "auth_profile": "member-session"
    },
    {
      "surface_id": "member.account-security-page",
      "kind": "page",
      "entry": "apps/portal-web/src/modules/AccountSecurity.tsx",
      "operations": [
        "member.password.change",
        "member.sessions.list",
        "member.sessions.revoke-others"
      ],
      "auth_profile": "member-session"
    },
    {
      "surface_id": "member.account-deactivation",
      "kind": "http",
      "entry": "apps/platform-api/src/routes/members.ts",
      "operations": [
        "member.account.deactivate"
      ],
      "auth_profile": "member-session"
    },
    {
      "surface_id": "member.account-deactivation-form",
      "kind": "page",
      "entry": "apps/portal-web/src/modules/AccountDeactivation.tsx",
      "operations": [
        "member.account.read",
        "member.account.deactivate"
      ],
      "auth_profile": "member-session"
    },
    {
      "surface_id": "member.email-change.request",
      "kind": "http",
      "entry": "apps/platform-api/src/platform-app.ts",
      "operations": [
        "member.email-change.request"
      ],
      "auth_profile": "member-session-password-csrf"
    },
    {
      "surface_id": "member.email-change.confirm",
      "kind": "http",
      "entry": "apps/platform-api/src/platform-app.ts",
      "operations": [
        "member.email-change.confirm"
      ],
      "auth_profile": "single-use-email-proof"
    },
    {
      "surface_id": "member.email-change.page",
      "kind": "page",
      "entry": "apps/portal-web/src/modules/EmailChange.tsx",
      "operations": [
        "member.email-change.request",
        "member.email-change.confirm"
      ],
      "auth_profile": "member-session-or-single-use-email-proof"
    },
    {
      "surface_id": "member.email-verification.request",
      "kind": "http",
      "entry": "apps/platform-api/src/platform-app.ts",
      "operations": [
        "member.email-verification.request"
      ],
      "auth_profile": "member-session-csrf"
    },
    {
      "surface_id": "member.email-verification.confirm",
      "kind": "http",
      "entry": "apps/platform-api/src/platform-app.ts",
      "operations": [
        "member.email-verification.confirm"
      ],
      "auth_profile": "single-use-email-proof"
    },
    {
      "surface_id": "member.email-verification.page",
      "kind": "page",
      "entry": "apps/portal-web/src/modules/EmailVerification.tsx",
      "operations": [
        "member.email-verification.request",
        "member.email-verification.confirm"
      ],
      "auth_profile": "member-session-or-single-use-email-proof"
    },
    {
      "surface_id": "member.totp",
      "kind": "http",
      "entry": "apps/platform-api/src/platform-app.ts",
      "operations": [
        "member.totp.status",
        "member.totp.enable",
        "member.totp.disable"
      ],
      "auth_profile": "member-session-csrf-password-second-factor"
    },
    {
      "surface_id": "member.totp.page",
      "kind": "page",
      "entry": "apps/portal-web/src/modules/TotpSettings.tsx",
      "operations": [
        "member.totp.status",
        "member.totp.enable",
        "member.totp.disable"
      ],
      "auth_profile": "member-session"
    }
  ],
  "tests": [
    "runtime.member-card",
    "runtime.full"
  ]
}
