{
  "format": "freedom.module/v1",
  "module_id": "runtime-registration",
  "owner_role": "foundation",
  "owned_paths": [
    "packages/sdk/machine-device-client.mjs",
    "tests/runtime/machine-device-client.test.ts",
    "tests/runtime/machine-device-response-boundary.test.ts",
    "modules/agent-control/**",
    "contracts/execution/v1/**",
    "migrations/087_runtime_registrations.sql",
    "migrations/088_agent_connections.sql",
    "migrations/089_bootstrap_nonces.sql",
    "tests/runtime/runtime-proof.test.ts",
    "tests/runtime/runtime-registration.test.ts",
    "tests/runtime/runtime-registration-adversarial.test.ts",
    "tests/runtime/runtime-registration-contracts.test.ts",
    "tests/runtime/runtime-registration-grants.test.ts",
    "tests/runtime/agent-connections.test.ts",
    "tests/runtime/agent-connections-adversarial.test.ts",
    "tests/runtime/bootstrap-proof.test.ts",
    "tests/runtime/bootstrap-contracts.test.ts",
    "tests/runtime/bootstrap-status.test.ts",
    "tests/runtime/bootstrap-status-adversarial.test.ts",
    "migrations/090_device_authorizations.sql",
    "tests/runtime/bootstrap-issuer.test.ts",
    "tests/runtime/device-authorizations.test.ts",
    "tests/runtime/device-authorizations-adversarial.test.ts",
    "tests/runtime/device-pairing-contracts.test.ts",
    "tests/runtime/device-pairing-proof.test.ts",
    "migrations/091_bootstrap_sessions.sql",
    "tests/runtime/bootstrap-session-contracts.test.ts",
    "tests/runtime/bootstrap-session-proof.test.ts",
    "tests/runtime/bootstrap-sessions.test.ts",
    "tests/runtime/bootstrap-sessions-adversarial.test.ts",
    "apps/platform-api/src/routes/bootstrap-http.ts",
    "tests/runtime/bootstrap-http.test.ts",
    "tests/runtime/bootstrap-http-contracts.test.ts",
    "migrations/096_model_broker_authorizations.sql",
    "tests/runtime/model-broker-authorizations.test.ts",
    "migrations/097_credential_ingest_authorizations.sql",
    "apps/platform-api/src/credential-ingest-client.ts",
    "apps/platform-api/src/routes/member-credential-ingest-http.ts",
    "tests/runtime/credential-ingest-authorizations.test.ts",
    "apps/portal-web/src/modules/DeviceConnections.tsx",
    "apps/portal-web/src/modules/DeviceConnections.css",
    "apps/portal-web/src/modules/member-device-client.ts",
    "tests/runtime/member-device-bootstrap-http.test.ts",
    "tests/runtime/member-device-bootstrap-adversarial.test.ts",
    "tests/runtime/member-device-browser.test.ts",
    "tests/runtime/member-device-client.test.ts",
    "tests/e2e/device-connections.spec.ts",
    "tests/e2e/device-connections-visual.ts",
    "packages/sdk/machine-device-cli.mjs",
    "contracts/execution/v3/machine-text-execution.ts",
    "contracts/execution/v3/machine-text-proof.schema.json",
    "contracts/execution/v3/machine-text-access.schema.json",
    "migrations/117_machine_text_execution.sql",
    "tests/runtime/machine-text-proof.test.ts",
    "tests/runtime/machine-text-authority.test.ts",
    "tests/runtime/machine-text-fixtures.ts",
    "contracts/execution/v3/machine-model-broker.ts",
    "migrations/119_machine_model_invocations.sql",
    "deploy/cloudflare/sql/20-runtime-grants.psql",
    "apps/platform-api/src/machine-model-broker-client.ts",
    "apps/platform-api/src/routes/machine-model-http.ts",
    "tests/runtime/machine-model-http.test.ts",
    "tests/runtime/machine-model-execution.test.ts",
    "tests/runtime/machine-model-revocation.test.ts"
  ],
  "public_exports": [
    "packages/sdk/machine-device-client.mjs",
    "packages/sdk/machine-device-cli.mjs",
    "contracts/execution/v1/runtime-registration.ts",
    "contracts/execution/v1/bootstrap.ts",
    "contracts/execution/v1/bootstrap-status.ts",
    "contracts/execution/v1/device-pairing.ts",
    "modules/agent-control/runtime-proof.ts",
    "modules/agent-control/runtime-registration.ts",
    "modules/agent-control/agent-connections.ts",
    "modules/agent-control/bootstrap-proof.ts",
    "modules/agent-control/bootstrap-status.ts",
    "modules/agent-control/device-pairing-proof.ts",
    "modules/agent-control/bootstrap-issuer.ts",
    "modules/agent-control/device-authorizations.ts",
    "contracts/execution/v1/bootstrap-session.ts",
    "modules/agent-control/bootstrap-session-proof.ts",
    "modules/agent-control/bootstrap-sessions.ts",
    "contracts/execution/v1/bootstrap-http.ts",
    "apps/platform-api/src/routes/bootstrap-http.ts",
    "modules/agent-control/bootstrap-http-limits.ts"
  ],
  "dependencies": [
    "execution-decision",
    "resource-scopes",
    "scoped-commands"
  ],
  "contract_families": [
    "common",
    "runtime-enrollment",
    "agent-connection",
    "bootstrap-proof",
    "bootstrap-status",
    "device-pairing",
    "bootstrap-session",
    "bootstrap-http",
    "model-broker-bridge",
    "model-credential-ingest"
  ],
  "client_profiles": [],
  "instructions": [
    "modules/agent-control/README.md",
    "modules/agent-control/agent-connections.md",
    "modules/agent-control/bootstrap-proof.md",
    "modules/agent-control/bootstrap-status.md",
    "modules/agent-control/device-pairing-proof.md",
    "modules/agent-control/device-authorizations.md",
    "docs/platform-plan/execution/unified-foundation/07-runtime-enrollment.md",
    "docs/platform-plan/execution/unified-foundation/08-agent-connections-bootstrap.md",
    "docs/platform-plan/execution/unified-foundation/09-bootstrap-status.md",
    "docs/platform-plan/execution/unified-foundation/10-device-authorization.md",
    "packages/scoped-commands/README.md",
    "modules/agent-control/bootstrap-session-proof.md",
    "modules/agent-control/bootstrap-sessions.md",
    "docs/platform-plan/execution/unified-foundation/11-bootstrap-sessions.md",
    "docs/platform-plan/execution/unified-foundation/12-bootstrap-http.md",
    "docs/platform-plan/execution/unified-foundation/19-authenticated-broker-bridge.md",
    "docs/platform-plan/execution/unified-foundation/20-direct-credential-ingest.md"
  ],
  "invariants": [
    "current-authority-before-replay",
    "public-challenge-not-bearer",
    "real-signature-and-atomic-consumption",
    "no-key-squatting",
    "immutable-owner-key-environment",
    "revocation-no-resurrection",
    "connection-bound-owner-client-runtime",
    "cryptographic-evidence-not-machine-authority",
    "single-use-nonce-and-proof-id",
    "post-await-database-decision-clock",
    "exact-reviewed-device-binding",
    "enrollment-owned-by-one-time-exchange",
    "durable-throttle-without-secret-receipts",
    "no-operational-execution-authority",
    "one-use-refresh-rotation",
    "verified-reuse-commits-whole-family-revocation",
    "nonce-acquisition-requires-live-family",
    "http-purpose-origin-credential-kind-isolation",
    "committed-http-abuse-charge",
    "unmounted-without-production-trust",
    "original-session-command-not-wire-actor",
    "one-use-transport-admission-not-domain-dispatch",
    "initial-cas-then-stage-domain-fences",
    "separate-one-use-ingest-purpose-original-session",
    "main-metadata-only-without-secret-proxy",
    "immutable-no-extension-bootstrap-submission-claims"
  ],
  "tests": [
    "runtime.full"
  ],
  "surfaces": [
    {
      "surface_id": "member.device-connections",
      "kind": "page",
      "entry": "apps/portal-web/src/modules/DeviceConnections.tsx",
      "operations": [
        "device.pairing.inspect",
        "device.pairing.decide",
        "agent.connection.list",
        "agent.connection.read",
        "agent.connection.revoke"
      ],
      "auth_profile": "member-session"
    },
    {
      "surface_id": "member.device-connections-api",
      "kind": "http",
      "entry": "apps/platform-api/src/routes/bootstrap-http.ts",
      "operations": [
        "device.pairing.inspect",
        "device.pairing.decide",
        "agent.connection.list",
        "agent.connection.read",
        "agent.connection.revoke"
      ],
      "auth_profile": "member-session"
    },
    {
      "surface_id": "bootstrap.device-auth-api",
      "kind": "http",
      "entry": "apps/platform-api/src/routes/bootstrap-http.ts",
      "operations": [
        "device.pairing.begin",
        "device.pairing.poll",
        "bootstrap.refresh",
        "bootstrap.nonce",
        "bootstrap.status"
      ],
      "auth_profile": "device-proof-and-bootstrap-purpose"
    }
  ]
}
