{
  "format": "freedom.module/v1",
  "module_id": "social-feed",
  "owner_role": "foundation",
  "owned_paths": [
    "apps/portal-web/src/modules/SocialZone.tsx",
    "apps/portal-web/src/modules/SocialZone.css",
    "apps/portal-web/src/modules/social-image.ts",
    "tests/e2e/social-feed.spec.ts",
    "tests/e2e/share-promotion.spec.ts",
    "tests/e2e/social-image.spec.ts",
    "tests/runtime/social-feed.test.ts",
    "apps/portal-web/src/PlatformPurpose.tsx",
    "apps/portal-web/src/SocialLayout.css",
    "apps/portal-web/src/modules/MemberHome.tsx",
    "apps/portal-web/src/modules/member-home-loading.ts",
    "tests/runtime/member-home-loading.test.ts",
    "tests/e2e/member-home-loading.spec.ts",
    "apps/portal-web/src/modules/SocialCrossPlatformShare.tsx",
    "apps/portal-web/src/modules/SocialInteractions.tsx",
    "apps/portal-web/src/modules/SocialPostEditor.tsx",
    "apps/portal-web/src/modules/SocialPostShare.tsx",
    "apps/portal-web/src/modules/SocialTools.tsx",
    "apps/portal-web/src/social-share.ts",
    "tests/e2e/social-cross-platform-share.spec.ts",
    "tests/e2e/social-wall.spec.ts",
    "tests/runtime/social-post-edit.test.ts",
    "tests/runtime/social-share.test.ts",
    "migrations/147_social_post_edits.sql",
    "migrations/148_social_wall_interactions.sql",
    "modules/community/comment-images.ts",
    "modules/community/social-content.ts",
    "tests/e2e/member-home-next-step.spec.ts",
    "apps/portal-web/src/modules/ShortVideoFeed.tsx",
    "apps/portal-web/src/modules/ShortVideoFeed.css",
    "apps/portal-web/src/modules/InlineVideo.tsx",
    "apps/portal-web/src/modules/InlineVideo.css",
    "apps/portal-web/src/modules/short-video-embed.ts",
    "tests/e2e/short-videos.spec.ts",
    "tests/e2e/short-videos-lifecycle.spec.ts",
    "tests/e2e/short-videos-share.spec.ts",
    "tests/e2e/short-videos-focus.spec.ts",
    "tests/runtime/short-video-embed.test.ts",
    "tests/runtime/short-video-flag.test.ts"
  ],
  "public_exports": [],
  "dependencies": [
    "community",
    "asset-lifecycle",
    "skill-submissions",
    "asset-storage"
  ],
  "contract_families": [],
  "client_profiles": [
    "member"
  ],
  "instructions": [
    "AGENTS.md",
    "docs/development/share-promotion.md"
  ],
  "invariants": [
    "current-authority-before-replay",
    "no-secrets-in-artifacts"
  ],
  "tests": [
    "runtime.full"
  ],
  "surfaces": [
    {
      "surface_id": "community.social-feed-page",
      "kind": "page",
      "entry": "apps/portal-web/src/modules/SocialZone.tsx",
      "operations": [
        "community.social-feed-page.view"
      ],
      "auth_profile": "member-session"
    }
  ]
}
